{"v":"0.1","company":"http://localhost:3620/e/ferreteria-demo","op":"op_kXk0fUY1M3Eq","statements":["eyJhbGciOiJFUzI1NiIsImtpZCI6IkJSU3kwc3hRcW9kTk1QTEdwY0VlRzFyc0ZsV1UwbjdZbmFQN1o5algteU0iLCJ0eXAiOiJ2eHAtc3RtdCtzZC1qd3QifQ.eyJhdWQiOiJodHRwOi8vbG9jYWxob3N0OjM2MjIiLCJib2R5Ijp7ImNoYW5uZWwiOiJwYWN0IiwiY2xpZW50X2lkIjoiaHR0cDovL2xvY2FsaG9zdDozNjIyIiwicGFjdF9wcm9wb3NhbF9yZWNlaXB0Ijp7ImFyZ3NIYXNoIjoic2hhLTI1Njpld1NlcThUclZiU3FwOW05a2xMbzhEbktGS0FuNndrRG55UmVXNmdIdjBzIiwiZ3JhbnRJZCI6ImdyYW50X2doT20wZW9LUzE2ciJ9LCJyZXF1ZXN0X2RpZ2VzdCI6InNoYS0yNTY6ZXdTZXE4VHJWYlNxcDltOWtsTG84RG5LRktBbjZ3a0RueVJlVzZnSHYwcyJ9LCJjb21wYW55IjoiaHR0cDovL2xvY2FsaG9zdDozNjIwL2UvZmVycmV0ZXJpYS1kZW1vIiwiaWF0IjoxNzkyNjQ5MzI0LCJpc3MiOiJodHRwOi8vbG9jYWxob3N0OjM2MjAvc292cmFzL29wZXJhZG9yIiwia2luZCI6InJlcXVlc3QiLCJvcCI6Im9wX2tYazBmVVkxTTNFcSIsInByZXYiOm51bGwsInNlcSI6MCwidXNlciI6ImNsaV9hX2ZlcnJldGVyaWEiLCJ2IjoiMC4xIn0.0BCOURDl1PwVC6UJW4E-o5O0Q-n68eD9gZnistV5_1yPchueFiJ7HmBe9-G1CebjnSL5TVD2oMkJf-XtVf2mgQ~","eyJhbGciOiJFUzI1NiIsImtpZCI6Ik1NNkFRYXFmaUpVcmhRQ0RPSUhseWhia1l6a0tBT1Y3bUhUb1Fab3Q4T3MiLCJ0eXAiOiJ2eHAtc3RtdCtzZC1qd3QifQ.eyJhdWQiOiJodHRwOi8vbG9jYWxob3N0OjM2MjIiLCJib2R5Ijp7ImNhcGFiaWxpdHkiOiJwZWRpZG8ucmVwcm9ncmFtYXJfZGVzcGFjaG8iLCJjb21taXRtZW50Ijp7Im1vZGUiOiJmaXJtIiwicmVxdWlyZXMiOltdfSwiY29tcGFueV9yZXZpZXdfcmVxdWlyZWQiOmZhbHNlLCJleHBpcmVzX2F0IjoiMjAyNi0xMC0yMlQwNjoyMzo0NC45MTlaIiwicmVhZF9iYWNrX3Rlcm1zIjpbInBlZGlkbyIsImRlc3BhY2hvX251ZXZvIl0sInJldmlzaW9uIjoxLCJ0ZXJtc19kaWdlc3QiOiJzaGEtMjU2Ol9VNDBVc2QtektKOGpERTJ0bW5UelU5SzNwMGNOVXljUmV5enAxd3lKVnciLCJ1c2VyX2FwcHJvdmFsX3JlcXVpcmVkIjp0cnVlfSwiY29tcGFueSI6Imh0dHA6Ly9sb2NhbGhvc3Q6MzYyMC9lL2ZlcnJldGVyaWEtZGVtbyIsImlhdCI6MTc5MjY0OTMyNCwiaXNzIjoiaHR0cDovL2xvY2FsaG9zdDozNjIwL2UvZmVycmV0ZXJpYS1kZW1vIiwia2luZCI6InRlcm1zIiwib3AiOiJvcF9rWGswZlVZMU0zRXEiLCJwcmV2Ijoic2hhLTI1Njp6cWxGd0hkcDhEdVZ4N08wUHRfYk1vTzJIbXFIVk5YblR5N3ktbThiVEpjIiwic2VxIjoxLCJ1c2VyIjoiY2xpX2FfZmVycmV0ZXJpYSIsInYiOiIwLjEifQ.QqF1BK3J5e_Odm7_g-29_yyBYlgkmuqtWBhmj8rf7hu5yIIw3AdE6XkXcC2EqqbhcBPTP0Ajw8C4B26ZwwPibg~","eyJhbGciOiJFUzI1NiIsImtpZCI6IkJSU3kwc3hRcW9kTk1QTEdwY0VlRzFyc0ZsV1UwbjdZbmFQN1o5algteU0iLCJ0eXAiOiJ2eHAtc3RtdCtzZC1qd3QifQ.eyJhdWQiOiJodHRwOi8vbG9jYWxob3N0OjM2MjIiLCJib2R5Ijp7ImNoYW5uZWwiOiJ3aGF0c2FwcCIsImRpc3BsYXlfY29kZSI6IjA1NDU0NSIsImV2aWRlbmNlIjp7Il9zZCI6WyJfMnRMZ0E0MkczdFc0VUtPR09zQWRPWWRRaUs2RTdRd0ZQd01ydk9IR3dFIiwieV90c1gtZ3kxQnRkbi12cTFjSV9LZHZCbm56djJBNlNHb2pQU1l2ZDdEUSJdfSwibWV0aG9kIjoiY29tcGFueV9jaGFubmVsIiwicmV2aXNpb24iOjEsInRlcm1zX2RpZ2VzdCI6InNoYS0yNTY6X1U0MFVzZC16S0o4akRFMnRtblR6VTlLM3AwY05VeWNSZXl6cDF3eUpWdyJ9LCJjb21wYW55IjoiaHR0cDovL2xvY2FsaG9zdDozNjIwL2UvZmVycmV0ZXJpYS1kZW1vIiwiaWF0IjoxNzkyNjQ5MzI0LCJpc3MiOiJodHRwOi8vbG9jYWxob3N0OjM2MjAvc292cmFzL29wZXJhZG9yIiwia2luZCI6InVzZXJfYXBwcm92YWwiLCJvcCI6Im9wX2tYazBmVVkxTTNFcSIsInByZXYiOiJzaGEtMjU2OjdKVWFWZ2YyVDlBeF85bHAyTkh2Q3h6WWg5RFMzRWxZRXU5UmRQSTAtZmMiLCJzZXEiOjIsInVzZXIiOiJjbGlfYV9mZXJyZXRlcmlhIiwidiI6IjAuMSJ9.9p7uY0cFFCriYNp3m940y5WFelypJCAyefHy0auLZmrDowp9KoFAErepKha75DNhudExVEvkUq8NjHGPYOGVNg~WyJ0ZWRieUZyM2otM3BYdUdNbVptN0h3IiwiaW5ib3VuZF90ZXh0IiwiQVBST0JBUiAwNTQ1NDUiXQ~WyJWTURYU0xuN21JN0xfZXgtZ1ZpYkZnIiwicHJvdmlkZXJfbWVzc2FnZV9pZCIsIndhbWlkLlBSVUVCQS5oYWhZUVAtcVo0dTEiXQ~","eyJhbGciOiJFUzI1NiIsImtpZCI6IkJSU3kwc3hRcW9kTk1QTEdwY0VlRzFyc0ZsV1UwbjdZbmFQN1o5algteU0iLCJ0eXAiOiJ2eHAtc3RtdCtzZC1qd3QifQ.eyJhdWQiOiJodHRwOi8vbG9jYWxob3N0OjM2MjIiLCJib2R5Ijp7ImF0dGVtcHQiOjEsImNhcGFiaWxpdHkiOiJwZWRpZG8ucmVwcm9ncmFtYXJfZGVzcGFjaG8iLCJyZWxlYXNlIjoic2hhLTI1Njp1MVRCQnhKWFRLdGEzNks1VUlfal9teWhRYUh6YlBQMkhjRjRyQktHeFBBIiwicmV2aXNpb24iOjEsInRlcm1zX2RpZ2VzdCI6InNoYS0yNTY6X1U0MFVzZC16S0o4akRFMnRtblR6VTlLM3AwY05VeWNSZXl6cDF3eUpWdyJ9LCJjb21wYW55IjoiaHR0cDovL2xvY2FsaG9zdDozNjIwL2UvZmVycmV0ZXJpYS1kZW1vIiwiaWF0IjoxNzkyNjQ5MzI0LCJpc3MiOiJodHRwOi8vbG9jYWxob3N0OjM2MjAvc292cmFzL29wZXJhZG9yIiwia2luZCI6ImV4ZWN1dGlvbiIsIm9wIjoib3Bfa1hrMGZVWTFNM0VxIiwicHJldiI6InNoYS0yNTY6TUstakhxaTlTVU9Lb1JuWUlTREZycHRLNEhnbXBxa0NfMWt6NmZ1RUJsWSIsInNlcSI6MywidXNlciI6ImNsaV9hX2ZlcnJldGVyaWEiLCJ2IjoiMC4xIn0.BjcwuYO1JoWd5DR3t9QPQPOEGK2G-HRl8Wwzk3FxtXYeAR6Qvjx3kZ1kUa7xEnxHCMNyLnxlGEtS_vwU7FB3sQ~","eyJhbGciOiJFUzI1NiIsImtpZCI6IkJSU3kwc3hRcW9kTk1QTEdwY0VlRzFyc0ZsV1UwbjdZbmFQN1o5algteU0iLCJ0eXAiOiJ2eHAtc3RtdCtzZC1qd3QifQ.eyJhdWQiOiJodHRwOi8vbG9jYWxob3N0OjM2MjIiLCJib2R5Ijp7Im1hdGNoZXNfdGVybXMiOnRydWUsIm1ldGhvZCI6InN5c3RlbV9yZWFkX2JhY2siLCJvYnNlcnZlZCI6eyJfc2QiOlsiZlFmMzhRelMwXzl4UmhzSzNqT3NxQ1BPYWNDbFFyQldHcFlaOEM5NnhndyJdLCJkZXNwYWNob19udWV2byI6IjIwMjYtMTAtMjgiLCJwZWRpZG8iOiJQLTEwNDIifSwic291cmNlIjoiY29tcGFueV9zeXN0ZW0ifSwiY29tcGFueSI6Imh0dHA6Ly9sb2NhbGhvc3Q6MzYyMC9lL2ZlcnJldGVyaWEtZGVtbyIsImlhdCI6MTc5MjY0OTMyNCwiaXNzIjoiaHR0cDovL2xvY2FsaG9zdDozNjIwL3NvdnJhcy9vcGVyYWRvciIsImtpbmQiOiJyZWFkX2JhY2siLCJvcCI6Im9wX2tYazBmVVkxTTNFcSIsInByZXYiOiJzaGEtMjU2OmU5MG1nbzRkOUlaZzNURWRIalB6UGZpZ2dWbVZrdlhiMUJldkFmaTUxazQiLCJzZXEiOjQsInVzZXIiOiJjbGlfYV9mZXJyZXRlcmlhIiwidiI6IjAuMSJ9.cTkquERLBPkSUgNXaQijwKAQDg8qLoIDJpvGq8IkxPHIwTlaev7-cdrQBeGNl5ujPAL2edxNSfiLz4UnHyNPOQ~WyJUbjdTTFdSYkhnbFZhM1ZaMG5NQjhnIiwiZGlyZWNjaW9uIiwiQ2FsbGUgRWplbXBsbyAxMDAsIFNhbnRpYWdvIl0~","eyJhbGciOiJFUzI1NiIsImtpZCI6Ik1NNkFRYXFmaUpVcmhRQ0RPSUhseWhia1l6a0tBT1Y3bUhUb1Fab3Q4T3MiLCJ0eXAiOiJ2eHAtc3RtdCtzZC1qd3QifQ.eyJhdWQiOiJodHRwOi8vbG9jYWxob3N0OjM2MjIiLCJib2R5Ijp7ImNsYWltZWRfYXNzdXJhbmNlIjpbImlzc3Vlcl9rZXlfYXR0ZXN0ZWQiLCJvcGVyYXRvcl9vYnNlcnZlZCIsIm9wZXJhdG9yX3JlcG9ydGVkX3JlYWRfYmFjayIsIm9wZXJhdG9yX3JlcG9ydGVkX2NoYW5uZWxfYXBwcm92YWwiXSwicmVzdWx0X3N1bW1hcnlfZGlnZXN0Ijoic2hhLTI1NjphS3MzdXk3N2Mxb3NnRDdxU2dUcU5KMF9ZSVRyb2M1aXdvWUhxRm1TbDZzIiwicmV2aXNpb24iOjEsInN0YXRlIjoic3VjY2VlZGVkIiwidGVybXNfZGlnZXN0Ijoic2hhLTI1NjpfVTQwVXNkLXpLSjhqREUydG1uVHpVOUszcDBjTlV5Y1JleXpwMXd5SlZ3IiwidGhpcmRfcGFydHkiOltdfSwiY29tcGFueSI6Imh0dHA6Ly9sb2NhbGhvc3Q6MzYyMC9lL2ZlcnJldGVyaWEtZGVtbyIsImlhdCI6MTc5MjY0OTMyNCwiaXNzIjoiaHR0cDovL2xvY2FsaG9zdDozNjIwL2UvZmVycmV0ZXJpYS1kZW1vIiwia2luZCI6Im91dGNvbWUiLCJvcCI6Im9wX2tYazBmVVkxTTNFcSIsInByZXYiOiJzaGEtMjU2Om5fM2VFdzk2NEFXeE1Ba00wUE01aE1nenkxdHNlZGpxQ016dlI3OUEtb28iLCJzZXEiOjUsInVzZXIiOiJjbGlfYV9mZXJyZXRlcmlhIiwidiI6IjAuMSJ9.othUofkiHq2RTgt3T5B8YPcPf8EelKlg67S8A239PX7TCuhVASKUKZWeYb4lUfTYKF_vV-c4UV8AJCRMKR9bAw~"],"log":{"origin":"localhost:3620/sovras/log/v0","checkpoint":"eyJhbGciOiJFUzI1NiIsImtpZCI6Im5UTnJqa0tncW5NVUJFRnlTSFZ5ektOOU1TdG5kcWhtT2l4d0RYZUF4b3ciLCJ0eXAiOiJ2eHAtY2hlY2twb2ludCtqd3QifQ.eyJpYXQiOjE3OTI2NDkzMjQsIm9yaWdpbiI6ImxvY2FsaG9zdDozNjIwL3NvdnJhcy9sb2cvdjAiLCJyb290X2hhc2giOiJXbXRzMjVrME8tdDdjMnBROGhTUnlsX01UUFVRUExqcGFYR2dnZVotOTBzIiwidHJlZV9zaXplIjo2fQ.t8eQ39sTxSYNn0zXitOuu1lvNudOc53iMX_hksoc_tdbU0PWY2hdtmgFN7VoeUIzwOmC7hP0wDz9ixRnoiVGGQ","cosignatures":[],"inclusion":[{"seq":0,"leaf_index":0,"salt":"hOxS1R_FRNzD-0jSBJ5SdA1_epWyqRHCLlgvguCkFuE","tag":"BtTJDTLjUoxGnCZ8lZyldVoJZwFoYXDS5J_ZZnTp3JM","path":["rf9uMl8wl1pMcUBMaaxdR7KFaFH8Bf8uK1R1uDKc5rE","-k2mMHMOkaEEiZ215APAvwsGdbPgnYSdew2NBFIqEmc","-zPuVdzR9F_SEvYoJmVdtYsp2EXzknizgxFrX8LLfRU"]},{"seq":1,"leaf_index":1,"salt":"he3xk87Onzy_h2r73YeRQsHdN_t9rbEOZxoc9ioFkuo","tag":"JzVmF7-6kXr8bKW6sjL3pgbB2gNll0_S7cKHfnQb0ZQ","path":["62tjMngWVQLQ1HBg3oJZbD7aLV9bKxfKyxM6XBc8ork","-k2mMHMOkaEEiZ215APAvwsGdbPgnYSdew2NBFIqEmc","-zPuVdzR9F_SEvYoJmVdtYsp2EXzknizgxFrX8LLfRU"]},{"seq":2,"leaf_index":2,"salt":"K9HluxNbYrgN0RdHcl8nYkw3yXwgMPi00Z4NkkkSXLg","tag":"vCNgntEq4sahzggAV0cxdEqqDrBp-SaqUXerKXcR64w","path":["d4B3or-YfqhLhJIxDCpA6zgb7vQJzIFvu9S1Sm0n7Gs","Dnu_VZKOSxkZ29Y1ubMCnD-rnIWgKgUCaIyAYXLgzMs","-zPuVdzR9F_SEvYoJmVdtYsp2EXzknizgxFrX8LLfRU"]},{"seq":3,"leaf_index":3,"salt":"ILB_GmbJewsZXXLj4RB3znmT1MlR1D4BVzPfJk2pVYY","tag":"7oy73YlPzVstUeU19QZTLBorF9AHlCyw8XH2XClNMuU","path":["bw7PTlAsjHGgDWUwCSWUxy8HPo8dsxyE0uV9eErBQH4","Dnu_VZKOSxkZ29Y1ubMCnD-rnIWgKgUCaIyAYXLgzMs","-zPuVdzR9F_SEvYoJmVdtYsp2EXzknizgxFrX8LLfRU"]},{"seq":4,"leaf_index":4,"salt":"9B-rMHE2Mcmrn8c0vM5fCaZbU5BhsqDQs09A5fen6dU","tag":"6wGu3I3mH9wcNsoQaSNtmCc7Yi5bawB7-R2p8cHTu6c","path":["6bHNEiHmxjF50AE3Gdt40QtGMDOTvyri_EEim-8G83k","T7byb7WpmYxLlakE-na51yAxNlVlBQXnaU8A3xD8KIM"]},{"seq":5,"leaf_index":5,"salt":"O6-wivnngJCueKhAMw_RVZXxE9AVtkd_3LrEKfKuYjg","tag":"LkjppuUIIEtPH_XqOU3tx62GBqq4T_8zNKLTLE_8tdI","path":["NROSvgJIKJPq6nLGZuJmsL6JR-JjlxgSDmbenXlI_W0","T7byb7WpmYxLlakE-na51yAxNlVlBQXnaU8A3xD8KIM"]}]}}