{
 "v": "0.1",
 "company": "http://localhost:3730/e/ferreteria-demo",
 "op": "op_XzdILOmlgiae",
 "statements": [
  "eyJhbGciOiJFUzI1NiIsImtpZCI6IkJOZ1RhMjhFS0R2a2pVRFUwdFdlcjNuZVZ0ZVBuNVZxeFR1X1RqUzNfSXMiLCJ0eXAiOiJ2eHAtc3RtdCtzZC1qd3QifQ.eyJhdWQiOiJodHRwOi8vbG9jYWxob3N0OjM3MzQvYWdlbnQuanNvbiIsImJvZHkiOnsiY2hhbm5lbCI6InZ4cCIsImNsaWVudF9pZCI6Imh0dHA6Ly9sb2NhbGhvc3Q6MzczNC9hZ2VudC5qc29uIiwicmVxdWVzdF9kaWdlc3QiOiJzaGEtMjU2Om1mSmxlb3NvNW9FeXRfcHFKUzNPdGJtWWFtN2N5bmNSQnJBY3FiS2ZJckkifSwiY29tcGFueSI6Imh0dHA6Ly9sb2NhbGhvc3Q6MzczMC9lL2ZlcnJldGVyaWEtZGVtbyIsImlhdCI6MTc5MjcwODIyOSwiaXNzIjoiaHR0cDovL2xvY2FsaG9zdDozNzMwL3Z4cC9vcGVyYXRvciIsImtpbmQiOiJyZXF1ZXN0Iiwib3AiOiJvcF9YemRJTE9tbGdpYWUiLCJwcmV2IjpudWxsLCJzZXEiOjAsInVzZXIiOiJ1c3JfMDEyNGVmNDAiLCJ2IjoiMC4xIn0.wBOyvDXVc8EQXuv-kCOiICCtOKHvWW9lWvDDKPYJAqFKL4SbYHHg33vvxdMew86tIa-nG-jheyHP-kKps6Oojg~",
  "eyJhbGciOiJFUzI1NiIsImtpZCI6IlFfTG02WWJJcWxSblEzYmxROXdqLWwybE9MM3JGWlF0ZHI4SzI4VGVLdzgiLCJ0eXAiOiJ2eHAtc3RtdCtzZC1qd3QifQ.eyJhdWQiOiJodHRwOi8vbG9jYWxob3N0OjM3MzQvYWdlbnQuanNvbiIsImJvZHkiOnsiY2FwYWJpbGl0eSI6InBlZGlkby5yZXByb2dyYW1hcl9kZXNwYWNobyIsImNvbW1pdG1lbnQiOnsibW9kZSI6ImZpcm0iLCJyZXF1aXJlcyI6W119LCJjb21wYW55X3Jldmlld19yZXF1aXJlZCI6ZmFsc2UsImV4cGlyZXNfYXQiOiIyMDI2LTEwLTIyVDIyOjQ1OjI5LjM1NloiLCJyZWFkX2JhY2tfdGVybXMiOlsicGVkaWRvIiwiZGVzcGFjaG9fbnVldm8iXSwicmV2aXNpb24iOjEsInRlcm1zX2RpZ2VzdCI6InNoYS0yNTY6TGV4Y2NRMklyWFR3a3gtek0zS0ozbTJTZjUtWUhzcXpzLXBvX1FDeEFDMCIsInVzZXJfYXBwcm92YWxfcmVxdWlyZWQiOnRydWV9LCJjb21wYW55IjoiaHR0cDovL2xvY2FsaG9zdDozNzMwL2UvZmVycmV0ZXJpYS1kZW1vIiwiaWF0IjoxNzkyNzA4MjI5LCJpc3MiOiJodHRwOi8vbG9jYWxob3N0OjM3MzAvZS9mZXJyZXRlcmlhLWRlbW8iLCJraW5kIjoidGVybXMiLCJvcCI6Im9wX1h6ZElMT21sZ2lhZSIsInByZXYiOiJzaGEtMjU2OmtBTzVmLUpvQ1NvbnFDUW5HXzF2a2kxVDAxd21xaDR3RFM1WUs3NFUwdjQiLCJzZXEiOjEsInVzZXIiOiJ1c3JfMDEyNGVmNDAiLCJ2IjoiMC4xIn0.9cVCeSmxG2uT_vp55aSfLYgb0EQW4W6qGRRJQ8DhVUU92GbUvcfEX6R_m5vwb4LxGOPHEHmT9Bci5Oh0T0UmxA~",
  "eyJhbGciOiJFUzI1NiIsImtpZCI6IkJOZ1RhMjhFS0R2a2pVRFUwdFdlcjNuZVZ0ZVBuNVZxeFR1X1RqUzNfSXMiLCJ0eXAiOiJ2eHAtc3RtdCtzZC1qd3QifQ.eyJhdWQiOiJodHRwOi8vbG9jYWxob3N0OjM3MzQvYWdlbnQuanNvbiIsImJvZHkiOnsibWV0aG9kIjoiYWdlbnRfYXNzZXJ0ZWQiLCJyZXZpc2lvbiI6MSwidGVybXNfZGlnZXN0Ijoic2hhLTI1NjpMZXhjY1EySXJYVHdreC16TTNLSjNtMlNmNS1ZSHNxenMtcG9fUUN4QUMwIn0sImNvbXBhbnkiOiJodHRwOi8vbG9jYWxob3N0OjM3MzAvZS9mZXJyZXRlcmlhLWRlbW8iLCJpYXQiOjE3OTI3MDgyMjksImlzcyI6Imh0dHA6Ly9sb2NhbGhvc3Q6MzczMC92eHAvb3BlcmF0b3IiLCJraW5kIjoidXNlcl9hcHByb3ZhbCIsIm9wIjoib3BfWHpkSUxPbWxnaWFlIiwicHJldiI6InNoYS0yNTY6bENOcnViblI2TUx3VWh3aGNOVUNXYXFBS3hGR09WV0lseDNSYWZzOHYwOCIsInNlcSI6MiwidXNlciI6InVzcl8wMTI0ZWY0MCIsInYiOiIwLjEifQ.FFjDhDLBcRuIVOc60lwpZx5SEoA9Dy40_W58Ap6E2wuPfFUIxs7kaOiI56HTksmRT5IxLf71fjm4ABgv_ThUFg~",
  "eyJhbGciOiJFUzI1NiIsImtpZCI6IkJOZ1RhMjhFS0R2a2pVRFUwdFdlcjNuZVZ0ZVBuNVZxeFR1X1RqUzNfSXMiLCJ0eXAiOiJ2eHAtc3RtdCtzZC1qd3QifQ.eyJhdWQiOiJodHRwOi8vbG9jYWxob3N0OjM3MzQvYWdlbnQuanNvbiIsImJvZHkiOnsiYXR0ZW1wdCI6MSwiY2FwYWJpbGl0eSI6InBlZGlkby5yZXByb2dyYW1hcl9kZXNwYWNobyIsInJlbGVhc2UiOiJzaGEtMjU2OnUxVEJCeEpYVEt0YTM2SzVVSV9qX215aFFhSHpiUFAySGNGNHJCS0d4UEEiLCJyZXZpc2lvbiI6MSwidGVybXNfZGlnZXN0Ijoic2hhLTI1NjpMZXhjY1EySXJYVHdreC16TTNLSjNtMlNmNS1ZSHNxenMtcG9fUUN4QUMwIn0sImNvbXBhbnkiOiJodHRwOi8vbG9jYWxob3N0OjM3MzAvZS9mZXJyZXRlcmlhLWRlbW8iLCJpYXQiOjE3OTI3MDgyMjksImlzcyI6Imh0dHA6Ly9sb2NhbGhvc3Q6MzczMC92eHAvb3BlcmF0b3IiLCJraW5kIjoiZXhlY3V0aW9uIiwib3AiOiJvcF9YemRJTE9tbGdpYWUiLCJwcmV2Ijoic2hhLTI1Njp3azRKOW1fVkUxenpsTGhjMVFFWjdsM203VVNva1FpRjlndElDTU5mdDVVIiwic2VxIjozLCJ1c2VyIjoidXNyXzAxMjRlZjQwIiwidiI6IjAuMSJ9.5U51U-MIBN1otI0xKcmrAlKvcUWNOsjYPUXy_9tATEpaThDSwDGZwCuNQMaVXN7c4Cqlh6WD_JKqpY2OfdOG0g~",
  "eyJhbGciOiJFUzI1NiIsImtpZCI6IkJOZ1RhMjhFS0R2a2pVRFUwdFdlcjNuZVZ0ZVBuNVZxeFR1X1RqUzNfSXMiLCJ0eXAiOiJ2eHAtc3RtdCtzZC1qd3QifQ.eyJhdWQiOiJodHRwOi8vbG9jYWxob3N0OjM3MzQvYWdlbnQuanNvbiIsImJvZHkiOnsibWF0Y2hlc190ZXJtcyI6dHJ1ZSwibWV0aG9kIjoic3lzdGVtX3JlYWRfYmFjayIsIm9ic2VydmVkIjp7Il9zZCI6WyJnMU1aRktzcG5fZmNUUEJ5NUNPcFlJVmM2clBqZVFZdjliRjdRQkNydjVnIl0sImRlc3BhY2hvX251ZXZvIjoiMjAyNi0xMC0yOCIsInBlZGlkbyI6IlAtMTA0MiJ9LCJzb3VyY2UiOiJjb21wYW55X3N5c3RlbSJ9LCJjb21wYW55IjoiaHR0cDovL2xvY2FsaG9zdDozNzMwL2UvZmVycmV0ZXJpYS1kZW1vIiwiaWF0IjoxNzkyNzA4MjI5LCJpc3MiOiJodHRwOi8vbG9jYWxob3N0OjM3MzAvdnhwL29wZXJhdG9yIiwia2luZCI6InJlYWRfYmFjayIsIm9wIjoib3BfWHpkSUxPbWxnaWFlIiwicHJldiI6InNoYS0yNTY6R3MyR091NGF6WjZhRTFWYUtqbTJFZGo5MVp5YS1WUDR6UDlGYmM3MVZKdyIsInNlcSI6NCwidXNlciI6InVzcl8wMTI0ZWY0MCIsInYiOiIwLjEifQ.JM6iyYZuNQ8s98EwZN8r12y0-7wGFyME_SViSlvhHTjuH6z2N1bgLB7SbpODFBNUWNdd7YIvA-5bBAuoxAyD7g~WyJEMU1ldzk2alJVbU43NWtVRnpqblR3IiwiZGlyZWNjaW9uIiwiQ2FsbGUgRWplbXBsbyAxMDAsIFNhbnRpYWdvIl0~",
  "eyJhbGciOiJFUzI1NiIsImtpZCI6IlFfTG02WWJJcWxSblEzYmxROXdqLWwybE9MM3JGWlF0ZHI4SzI4VGVLdzgiLCJ0eXAiOiJ2eHAtc3RtdCtzZC1qd3QifQ.eyJhdWQiOiJodHRwOi8vbG9jYWxob3N0OjM3MzQvYWdlbnQuanNvbiIsImJvZHkiOnsiY2xhaW1lZF9hc3N1cmFuY2UiOlsiaXNzdWVyX2tleV9hdHRlc3RlZCIsIm9wZXJhdG9yX29ic2VydmVkIiwib3BlcmF0b3JfcmVwb3J0ZWRfcmVhZF9iYWNrIiwib3BlcmF0b3JfcmVwb3J0ZWRfYWdlbnRfYXBwcm92YWwiXSwicmVzdWx0X3N1bW1hcnlfZGlnZXN0Ijoic2hhLTI1NjphS3MzdXk3N2Mxb3NnRDdxU2dUcU5KMF9ZSVRyb2M1aXdvWUhxRm1TbDZzIiwicmV2aXNpb24iOjEsInN0YXRlIjoic3VjY2VlZGVkIiwidGVybXNfZGlnZXN0Ijoic2hhLTI1NjpMZXhjY1EySXJYVHdreC16TTNLSjNtMlNmNS1ZSHNxenMtcG9fUUN4QUMwIiwidGhpcmRfcGFydHkiOltdfSwiY29tcGFueSI6Imh0dHA6Ly9sb2NhbGhvc3Q6MzczMC9lL2ZlcnJldGVyaWEtZGVtbyIsImlhdCI6MTc5MjcwODIyOSwiaXNzIjoiaHR0cDovL2xvY2FsaG9zdDozNzMwL2UvZmVycmV0ZXJpYS1kZW1vIiwia2luZCI6Im91dGNvbWUiLCJvcCI6Im9wX1h6ZElMT21sZ2lhZSIsInByZXYiOiJzaGEtMjU2OmpmU0NGUk5SNFFqdm5EOVZqbWFOV2RoZkFnNGZ0VnhNV3k1eExyclQ2Sm8iLCJzZXEiOjUsInVzZXIiOiJ1c3JfMDEyNGVmNDAiLCJ2IjoiMC4xIn0.NHStX963GyqJjd3VAnhOnVXPclK95HTi-0kndyDPVmTrfceLclbz3wf6460UvRbCPp6cZ09JcKtx1dgdHKHI0w~"
 ],
 "log": {
  "origin": "localhost:3730/vxp/log/v0",
  "checkpoint": "eyJhbGciOiJFUzI1NiIsImtpZCI6IjN3bEhOdkdaNVdxLW92UllqN3VkM0ZRcm0yYnZfYnh5cnpsZDRzTEZJR28iLCJ0eXAiOiJ2eHAtY2hlY2twb2ludCtqd3QifQ.eyJpYXQiOjE3OTI3MDgyMjksIm9yaWdpbiI6ImxvY2FsaG9zdDozNzMwL3Z4cC9sb2cvdjAiLCJyb290X2hhc2giOiJrZUZNTmRpV2c0VWwxVTRxYmJxX09iWjZlQ3JFSHJYRjY2MHVGX25sTUdjIiwidHJlZV9zaXplIjo2fQ.sSiHWiKqyIaXW4Rdq82OgzwL3vPRX2AMgfIOpdAvIxmF21LEz6xtD5VMv7tiZUP2tYtZMyT0N0VE-G8XAaqXmA",
  "cosignatures": [],
  "inclusion": [
   {
    "seq": 0,
    "leaf_index": 0,
    "salt": "eOxqGkCJgVZ6sMV1Kq3l1a7ASiC0vqBzwBr2ItaA6bw",
    "tag": "5ssKNd3GSi8GROYEsJsqA_exJD-_XO66fq6JZH8L3h8",
    "path": [
     "cWYNDivHRGqsUumBbabgSTfpgECE0b5kEJtDXUKmEJ8",
     "9h78ruq4ki1hAV9rrXf_b9fvo4jumR2dKB5Qf1_ClkA",
     "Bwwi19T2_87M1Mi0GCxRbFZEcSmzGMOr4aruXLwDfQg"
    ]
   },
   {
    "seq": 1,
    "leaf_index": 1,
    "salt": "7iAvSlVISfXw2QWgHAKlxRwQhVI4tz1W8iEnEJ5BAb8",
    "tag": "2dnhcZNgVcExvk2wnaTRnVJ1oqgczrHleC4sNEI9UFA",
    "path": [
     "TXwCDRZ2muPq1DqCc7bisqGXCckNYz2DvU87b-pF9kU",
     "9h78ruq4ki1hAV9rrXf_b9fvo4jumR2dKB5Qf1_ClkA",
     "Bwwi19T2_87M1Mi0GCxRbFZEcSmzGMOr4aruXLwDfQg"
    ]
   },
   {
    "seq": 2,
    "leaf_index": 2,
    "salt": "3Mgulk4Lp4InUhQl2eLZVg8U9mfIiBT3mV3TCPP-T6Y",
    "tag": "DbrBd5Eq2B55l02CbHE7H6k08YoPD3DWI0iheWMdEHY",
    "path": [
     "yOVqwF6vyv_k8y4aAr2-pyKUDCuVPa-odHg0GRUgN0Q",
     "DkqJLxhFZaH53zIpywcZAXTk7DP0Bv5Mkv2fMl57UZU",
     "Bwwi19T2_87M1Mi0GCxRbFZEcSmzGMOr4aruXLwDfQg"
    ]
   },
   {
    "seq": 3,
    "leaf_index": 3,
    "salt": "4OXxePvlMU1atWkKojvRuZBLecMNmy1ZkpeHvHpjeWo",
    "tag": "B5RFwMqhdutV64sZY1U0cOSzAw7TWN_k7FEW69uAcHg",
    "path": [
     "cYj0JnFmosKM5SguSO3hL5y4M6NslbSvzF8VZ9IFUhc",
     "DkqJLxhFZaH53zIpywcZAXTk7DP0Bv5Mkv2fMl57UZU",
     "Bwwi19T2_87M1Mi0GCxRbFZEcSmzGMOr4aruXLwDfQg"
    ]
   },
   {
    "seq": 4,
    "leaf_index": 4,
    "salt": "K3IMAlRe93Sz2how8-rJKwp2354WBhhsGrwXgdL2Skg",
    "tag": "ly9pcRMjwN0awavTY1pl9G7CiEnOSBuCu63HtIiOVpk",
    "path": [
     "Pp90UtKPepXOD29GhnOHHtdDvr03ivJwvD-1ZNoT4V8",
     "f-9SHhvaAdhkB91YGYcqbXZaytDbVeby-_BIllGh0W4"
    ]
   },
   {
    "seq": 5,
    "leaf_index": 5,
    "salt": "jN-LAmmNq3YTiN9FseTrN9xRZGhnmOE5vXNElXaaLwo",
    "tag": "HbMUP4yAlKA6Y6MRYSsjDy67hcpzeN_8iSiuLQuOT28",
    "path": [
     "kkoXiMFIGN5XFXiCVPB70Gymn5BaXaCwqDEbq2ZEgD8",
     "f-9SHhvaAdhkB91YGYcqbXZaytDbVeby-_BIllGh0W4"
    ]
   }
  ]
 }
}