{"v":"0.1","company":"http://localhost:3620/e/ferreteria-demo","op":"op_YxV3xdcUxo5-","statements":["eyJhbGciOiJFUzI1NiIsImtpZCI6IkJOZ1RhMjhFS0R2a2pVRFUwdFdlcjNuZVZ0ZVBuNVZxeFR1X1RqUzNfSXMiLCJ0eXAiOiJ2eHAtc3RtdCtzZC1qd3QifQ.eyJhdWQiOiJodHRwOi8vbG9jYWxob3N0OjM2MjIiLCJib2R5Ijp7ImNoYW5uZWwiOiJwYWN0IiwiY2xpZW50X2lkIjoiaHR0cDovL2xvY2FsaG9zdDozNjIyIiwicGFjdF9wcm9wb3NhbF9yZWNlaXB0Ijp7ImFyZ3NIYXNoIjoic2hhLTI1Njpld1NlcThUclZiU3FwOW05a2xMbzhEbktGS0FuNndrRG55UmVXNmdIdjBzIiwiZ3JhbnRJZCI6ImdyYW50X1lvdENQWW9HY0hsMyJ9LCJyZXF1ZXN0X2RpZ2VzdCI6InNoYS0yNTY6ZXdTZXE4VHJWYlNxcDltOWtsTG84RG5LRktBbjZ3a0RueVJlVzZnSHYwcyJ9LCJjb21wYW55IjoiaHR0cDovL2xvY2FsaG9zdDozNjIwL2UvZmVycmV0ZXJpYS1kZW1vIiwiaWF0IjoxNzkyNzA4Mjc5LCJpc3MiOiJodHRwOi8vbG9jYWxob3N0OjM2MjAvdnhwL29wZXJhdG9yIiwia2luZCI6InJlcXVlc3QiLCJvcCI6Im9wX1l4VjN4ZGNVeG81LSIsInByZXYiOm51bGwsInNlcSI6MCwidXNlciI6ImNsaV9hX2ZlcnJldGVyaWEiLCJ2IjoiMC4xIn0.J9tb619DVFTlLyBwFAj0rA4UFoSC03Kn88X4TmepssUFQ20zCiZkbn5YZVYc3oHfki561taKIbppv7_D_b9vmw~","eyJhbGciOiJFUzI1NiIsImtpZCI6IlFfTG02WWJJcWxSblEzYmxROXdqLWwybE9MM3JGWlF0ZHI4SzI4VGVLdzgiLCJ0eXAiOiJ2eHAtc3RtdCtzZC1qd3QifQ.eyJhdWQiOiJodHRwOi8vbG9jYWxob3N0OjM2MjIiLCJib2R5Ijp7ImNhcGFiaWxpdHkiOiJwZWRpZG8ucmVwcm9ncmFtYXJfZGVzcGFjaG8iLCJjb21taXRtZW50Ijp7Im1vZGUiOiJmaXJtIiwicmVxdWlyZXMiOltdfSwiY29tcGFueV9yZXZpZXdfcmVxdWlyZWQiOmZhbHNlLCJleHBpcmVzX2F0IjoiMjAyNi0xMC0yMlQyMjo0NjoxOS4zODVaIiwicmVhZF9iYWNrX3Rlcm1zIjpbInBlZGlkbyIsImRlc3BhY2hvX251ZXZvIl0sInJldmlzaW9uIjoxLCJ0ZXJtc19kaWdlc3QiOiJzaGEtMjU2Ol9UX29vTy1YUVAxWXJnRmJzdDgwNnRBYnRybjVSQmxXZVhzWTROa2R3RUUiLCJ1c2VyX2FwcHJvdmFsX3JlcXVpcmVkIjp0cnVlfSwiY29tcGFueSI6Imh0dHA6Ly9sb2NhbGhvc3Q6MzYyMC9lL2ZlcnJldGVyaWEtZGVtbyIsImlhdCI6MTc5MjcwODI3OSwiaXNzIjoiaHR0cDovL2xvY2FsaG9zdDozNjIwL2UvZmVycmV0ZXJpYS1kZW1vIiwia2luZCI6InRlcm1zIiwib3AiOiJvcF9ZeFYzeGRjVXhvNS0iLCJwcmV2Ijoic2hhLTI1NjozQ2VyRTdsN3pBTnV6MU8zMHhJcXM2NzJBRzN0eXRFNnRDbEN5NVU2NjVBIiwic2VxIjoxLCJ1c2VyIjoiY2xpX2FfZmVycmV0ZXJpYSIsInYiOiIwLjEifQ.lN7GOaYC23E1g6uIx29qf-VvxevRkVz4DfotUIUIO2kYtJ-Caxdu5S-Kwqts4Gh3u4bDQq9xH9Oia_G2hRQ5mQ~","eyJhbGciOiJFUzI1NiIsImtpZCI6IkJOZ1RhMjhFS0R2a2pVRFUwdFdlcjNuZVZ0ZVBuNVZxeFR1X1RqUzNfSXMiLCJ0eXAiOiJ2eHAtc3RtdCtzZC1qd3QifQ.eyJhdWQiOiJodHRwOi8vbG9jYWxob3N0OjM2MjIiLCJib2R5Ijp7ImNoYW5uZWwiOiJ3aGF0c2FwcCIsImRpc3BsYXlfY29kZSI6IjU5MjAwMiIsImV2aWRlbmNlIjp7Il9zZCI6WyJXWXNzV1Q2UTVJZVUxZFg2NDVSaXo3aE5JdHhkb2hCckQ5b2Q0SldjTXVrIiwiX29Fc2hHZmt2WU1QNFk4T19ncmp0Nm9TTUF1MVlmVFF2VXd1QlBTV09FYyJdfSwibWV0aG9kIjoiY29tcGFueV9jaGFubmVsIiwicmV2aXNpb24iOjEsInRlcm1zX2RpZ2VzdCI6InNoYS0yNTY6X1Rfb29PLVhRUDFZcmdGYnN0ODA2dEFidHJuNVJCbFdlWHNZNE5rZHdFRSJ9LCJjb21wYW55IjoiaHR0cDovL2xvY2FsaG9zdDozNjIwL2UvZmVycmV0ZXJpYS1kZW1vIiwiaWF0IjoxNzkyNzA4Mjc5LCJpc3MiOiJodHRwOi8vbG9jYWxob3N0OjM2MjAvdnhwL29wZXJhdG9yIiwia2luZCI6InVzZXJfYXBwcm92YWwiLCJvcCI6Im9wX1l4VjN4ZGNVeG81LSIsInByZXYiOiJzaGEtMjU2Ono1bGtaVjktRUJMXzRSSlVqNFFhWlBQWEJiRVpITVpDWm14ekRWU0hCTDAiLCJzZXEiOjIsInVzZXIiOiJjbGlfYV9mZXJyZXRlcmlhIiwidiI6IjAuMSJ9.VJbAymREmxK8K0lGfnlwCBWoYLpHsGqaS66JftMr-ipYyeVu2k6aVtxnphyBVG4KAjAJ1Chg3uBMcL9ufVZ1iA~WyJQRDFRT3lfczg2cEwyRUJ3RkFXVnlnIiwiaW5ib3VuZF90ZXh0IiwiQVBST0JBUiA1OTIwMDIiXQ~WyJuVUVCU2FiRW1GQ0JJZEF1TzhZbUZRIiwicHJvdmlkZXJfbWVzc2FnZV9pZCIsIndhbWlkLlBSVUVCQS5JMUY1Nk9vdW5yS3UiXQ~","eyJhbGciOiJFUzI1NiIsImtpZCI6IkJOZ1RhMjhFS0R2a2pVRFUwdFdlcjNuZVZ0ZVBuNVZxeFR1X1RqUzNfSXMiLCJ0eXAiOiJ2eHAtc3RtdCtzZC1qd3QifQ.eyJhdWQiOiJodHRwOi8vbG9jYWxob3N0OjM2MjIiLCJib2R5Ijp7ImF0dGVtcHQiOjEsImNhcGFiaWxpdHkiOiJwZWRpZG8ucmVwcm9ncmFtYXJfZGVzcGFjaG8iLCJyZWxlYXNlIjoic2hhLTI1Njp1MVRCQnhKWFRLdGEzNks1VUlfal9teWhRYUh6YlBQMkhjRjRyQktHeFBBIiwicmV2aXNpb24iOjEsInRlcm1zX2RpZ2VzdCI6InNoYS0yNTY6X1Rfb29PLVhRUDFZcmdGYnN0ODA2dEFidHJuNVJCbFdlWHNZNE5rZHdFRSJ9LCJjb21wYW55IjoiaHR0cDovL2xvY2FsaG9zdDozNjIwL2UvZmVycmV0ZXJpYS1kZW1vIiwiaWF0IjoxNzkyNzA4Mjc5LCJpc3MiOiJodHRwOi8vbG9jYWxob3N0OjM2MjAvdnhwL29wZXJhdG9yIiwia2luZCI6ImV4ZWN1dGlvbiIsIm9wIjoib3BfWXhWM3hkY1V4bzUtIiwicHJldiI6InNoYS0yNTY6RkxkenVHZ3p4bER1eXJscXNsWWpkZVp2MmdLMDg4eTNqb0QtbGlTWVJHQSIsInNlcSI6MywidXNlciI6ImNsaV9hX2ZlcnJldGVyaWEiLCJ2IjoiMC4xIn0.4Nkd4ZD_E1iDsxHP0ZomalWOJWoaut27t1QXZ5JllcIbhSBNwSIdSLCcmlqEw2l7ntE0EGLqyKmUgid4DjQkfQ~","eyJhbGciOiJFUzI1NiIsImtpZCI6IkJOZ1RhMjhFS0R2a2pVRFUwdFdlcjNuZVZ0ZVBuNVZxeFR1X1RqUzNfSXMiLCJ0eXAiOiJ2eHAtc3RtdCtzZC1qd3QifQ.eyJhdWQiOiJodHRwOi8vbG9jYWxob3N0OjM2MjIiLCJib2R5Ijp7Im1hdGNoZXNfdGVybXMiOnRydWUsIm1ldGhvZCI6InN5c3RlbV9yZWFkX2JhY2siLCJvYnNlcnZlZCI6eyJfc2QiOlsicDZyaWFieUQxTkoxOHNvNE90aGZaWWpiR09XMERlWXp0cGhKaE5WMGowSSJdLCJkZXNwYWNob19udWV2byI6IjIwMjYtMTAtMjgiLCJwZWRpZG8iOiJQLTEwNDIifSwic291cmNlIjoiY29tcGFueV9zeXN0ZW0ifSwiY29tcGFueSI6Imh0dHA6Ly9sb2NhbGhvc3Q6MzYyMC9lL2ZlcnJldGVyaWEtZGVtbyIsImlhdCI6MTc5MjcwODI3OSwiaXNzIjoiaHR0cDovL2xvY2FsaG9zdDozNjIwL3Z4cC9vcGVyYXRvciIsImtpbmQiOiJyZWFkX2JhY2siLCJvcCI6Im9wX1l4VjN4ZGNVeG81LSIsInByZXYiOiJzaGEtMjU2OnNKdjJPeWZpcnIxZWVpbktaWDkzbzJFODB6T3RmQ1VFVU91RmNNTXNkY0UiLCJzZXEiOjQsInVzZXIiOiJjbGlfYV9mZXJyZXRlcmlhIiwidiI6IjAuMSJ9.skFP2pMzQA48l8dbAE1fTXKcvlmtDvXOXW4wuPqgL_PB4DMufQ2SVs9oWrpmupxKbRCFzyAA6uBaIw9PsMLnxQ~WyJCLTR1V05GNGtXblNNSzJsSXNlcjBRIiwiZGlyZWNjaW9uIiwiQ2FsbGUgRWplbXBsbyAxMDAsIFNhbnRpYWdvIl0~","eyJhbGciOiJFUzI1NiIsImtpZCI6IlFfTG02WWJJcWxSblEzYmxROXdqLWwybE9MM3JGWlF0ZHI4SzI4VGVLdzgiLCJ0eXAiOiJ2eHAtc3RtdCtzZC1qd3QifQ.eyJhdWQiOiJodHRwOi8vbG9jYWxob3N0OjM2MjIiLCJib2R5Ijp7ImNsYWltZWRfYXNzdXJhbmNlIjpbImlzc3Vlcl9rZXlfYXR0ZXN0ZWQiLCJvcGVyYXRvcl9vYnNlcnZlZCIsIm9wZXJhdG9yX3JlcG9ydGVkX3JlYWRfYmFjayIsIm9wZXJhdG9yX3JlcG9ydGVkX2NoYW5uZWxfYXBwcm92YWwiXSwicmVzdWx0X3N1bW1hcnlfZGlnZXN0Ijoic2hhLTI1NjphS3MzdXk3N2Mxb3NnRDdxU2dUcU5KMF9ZSVRyb2M1aXdvWUhxRm1TbDZzIiwicmV2aXNpb24iOjEsInN0YXRlIjoic3VjY2VlZGVkIiwidGVybXNfZGlnZXN0Ijoic2hhLTI1NjpfVF9vb08tWFFQMVlyZ0Zic3Q4MDZ0QWJ0cm41UkJsV2VYc1k0Tmtkd0VFIiwidGhpcmRfcGFydHkiOltdfSwiY29tcGFueSI6Imh0dHA6Ly9sb2NhbGhvc3Q6MzYyMC9lL2ZlcnJldGVyaWEtZGVtbyIsImlhdCI6MTc5MjcwODI3OSwiaXNzIjoiaHR0cDovL2xvY2FsaG9zdDozNjIwL2UvZmVycmV0ZXJpYS1kZW1vIiwia2luZCI6Im91dGNvbWUiLCJvcCI6Im9wX1l4VjN4ZGNVeG81LSIsInByZXYiOiJzaGEtMjU2OjZob1k3TmFnVG9nQmJkeEhEbkExYXRYcnV4RlRhV1RrUEFvaWhmODN0cEUiLCJzZXEiOjUsInVzZXIiOiJjbGlfYV9mZXJyZXRlcmlhIiwidiI6IjAuMSJ9.07hq5hW2stJQwQBBW_IBMDx69FmZIhSVUEaeP5ncdM5vzTd9BX4eHTFoob05Q17I-ccQVACW_8KZSVnRsyCgJw~"],"log":{"origin":"localhost:3620/vxp/log/v0","checkpoint":"eyJhbGciOiJFUzI1NiIsImtpZCI6IjN3bEhOdkdaNVdxLW92UllqN3VkM0ZRcm0yYnZfYnh5cnpsZDRzTEZJR28iLCJ0eXAiOiJ2eHAtY2hlY2twb2ludCtqd3QifQ.eyJpYXQiOjE3OTI3MDgyNzksIm9yaWdpbiI6ImxvY2FsaG9zdDozNjIwL3Z4cC9sb2cvdjAiLCJyb290X2hhc2giOiJPZmJTMmxJYklfMms2VU5YQ1FUd3NHNzR3S2ltVjFGa2hOd0JfVDVURnQ0IiwidHJlZV9zaXplIjo2fQ.NuXPDDdEJjLOGM4Y1TccM2PbA--5VInikrYVVx4jPIa5FYS-Jmz1jqPgDtxwUruJOkDsKtzd31Y_b_xb2OQ3Fg","cosignatures":[],"inclusion":[{"seq":0,"leaf_index":0,"salt":"vagsYzeK4JFJbQfOOIwpyvFBfsrQ2VsrpqlO6MAd0hU","tag":"J2tMP2SUgiQqb32wrXGx3ioUvUIga-BxBRWXNPEvVJU","path":["pbfAXIoYHdMfohu-uXLvGQA7pJ18h3DpWv1WWTpKBag","FwX_H41EzV9fRbkyP_CApzz1c6sw4pfM-6pbhDgIMT0","gq_iM3QZFtWevRQ1tSYDylrKhD9aGMBnBuSDUy-sSvI"]},{"seq":1,"leaf_index":1,"salt":"hQb-N_gROoxndrONch_3LJ9GultX5-q1nMNrb5lx8N8","tag":"VDp0pgopSzg1Dmh1mPnKSRQ_RTdjUIAjhhOdZR8GEmk","path":["jmEYUAtiitqbJ9j4IBG3NQA1HjqElXlXUFPszh2Cs7k","FwX_H41EzV9fRbkyP_CApzz1c6sw4pfM-6pbhDgIMT0","gq_iM3QZFtWevRQ1tSYDylrKhD9aGMBnBuSDUy-sSvI"]},{"seq":2,"leaf_index":2,"salt":"Wirfhhi3yPjHkxMvoDywaiLDLRpFbpi4SH2yYgbkdq0","tag":"HuV7fyoDo4MILiMffgJqS5S8bMYVFZ8PTxw_9b9hj4I","path":["uHoxAlXpaADMeig4MWJpOg8iet7AgS2LAaU1XsdeQOQ","xMpQuqJn_4p5RVihWhLO5Nv8yJqfU2-udVwuuQw39uo","gq_iM3QZFtWevRQ1tSYDylrKhD9aGMBnBuSDUy-sSvI"]},{"seq":3,"leaf_index":3,"salt":"ClyDkGafmietPQg90wwfHjfZIzcStM06w0obBejV_VI","tag":"zy0gsSi1MLN5CJY6taE9UYkBL9duApqhBOXOQ9Rd9wk","path":["O8Z-YPRgCfvPovMPDzFLq3ai4PEYwE9mnlij-N2nmas","xMpQuqJn_4p5RVihWhLO5Nv8yJqfU2-udVwuuQw39uo","gq_iM3QZFtWevRQ1tSYDylrKhD9aGMBnBuSDUy-sSvI"]},{"seq":4,"leaf_index":4,"salt":"LKerpePhj9MtzexYavCyBUqQH1H3rXSsMzTNHxlXayo","tag":"MMZDET0PNCNIjD0TcS7LhZFksga3w16kk2H1HlHMzxg","path":["b4vpqU1u4ece58U5OGveCRdmzwlg-2awQVznkJEJtTs","MsRps_VekqQwbM88dar2RCtLlu59ITkgSZkeRLSv8xA"]},{"seq":5,"leaf_index":5,"salt":"JOCxxZG6EE1j0W80nOQGyQT-4Fp3MMLNpWrZakghtbU","tag":"9mGC0O5yJG2Ud1QYTDqvvRW-7gfKUA5yhUTRToURzg8","path":["48G47y12vM0970oo0bQLCjgnaCuOB9A3zcOQhjfU6N4","MsRps_VekqQwbM88dar2RCtLlu59ITkgSZkeRLSv8xA"]}]}}